name,mana_cost,cmc,colors,type,supertypes,subtypes,text,power,toughness,loyalty,legalities
Auspicious Starrix,{4}{G},5.0,G,Creature — Elk Beast,,"Elk, Beast","Mutate {5}{G} (If you cast this spell for its mutate cost, put it over or under target non-Human creature you own. They mutate into the creature on top plus all abilities from under it.)
Whenever this creature mutates, exile cards from the top of your library until you exile X permanent cards, where X is the number of times this creature has mutated. Put those permanent cards onto the battlefield.",6,6,,"format: Commander, legality: Legal, format: Duel, legality: Legal, format: Explorer, legality: Legal, format: Gladiator, legality: Legal, format: Historic, legality: Legal, format: Historicbrawl, legality: Legal, format: Legacy, legality: Legal, format: Modern, legality: Legal, format: Oathbreaker, legality: Legal, format: Paupercommander, legality: Restricted, format: Penny, legality: Legal, format: Pioneer, legality: Legal, format: Vintage, legality: Legal"
Barrier Breach,{2}{G},3.0,G,Instant,,,"Exile up to three target enchantments.
Cycling {2} ({2}, Discard this card: Draw a card.)",,,,"format: Commander, legality: Legal, format: Duel, legality: Legal, format: Explorer, legality: Legal, format: Gladiator, legality: Legal, format: Historic, legality: Legal, format: Historicbrawl, legality: Legal, format: Legacy, legality: Legal, format: Modern, legality: Legal, format: Oathbreaker, legality: Legal, format: Penny, legality: Legal, format: Pioneer, legality: Legal, format: Vintage, legality: Legal"
Bristling Boar,{3}{G},4.0,G,Creature — Boar,,Boar,Bristling Boar can't be blocked by more than one creature.,4,3,,"format: Commander, legality: Legal, format: Duel, legality: Legal, format: Explorer, legality: Legal, format: Gladiator, legality: Legal, format: Historic, legality: Legal, format: Historicbrawl, legality: Legal, format: Legacy, legality: Legal, format: Modern, legality: Legal, format: Oathbreaker, legality: Legal, format: Pauper, legality: Legal, format: Paupercommander, legality: Legal, format: Penny, legality: Legal, format: Pioneer, legality: Legal, format: Vintage, legality: Legal"
Charge of the Forever-Beast,{2}{G},3.0,G,Sorcery,,,"As an additional cost to cast this spell, reveal a creature card from your hand.
Charge of the Forever-Beast deals damage to target creature or planeswalker equal to the revealed card's power.",,,,"format: Commander, legality: Legal, format: Duel, legality: Legal, format: Explorer, legality: Legal, format: Gladiator, legality: Legal, format: Historic, legality: Legal, format: Historicbrawl, legality: Legal, format: Legacy, legality: Legal, format: Modern, legality: Legal, format: Oathbreaker, legality: Legal, format: Penny, legality: Legal, format: Pioneer, legality: Legal, format: Vintage, legality: Legal"
Colossification,{5}{G}{G},7.0,G,Enchantment — Aura,,Aura,"Enchant creature
When Colossification enters the battlefield, tap enchanted creature.
Enchanted creature gets +20/+20.",,,,"format: Commander, legality: Legal, format: Duel, legality: Legal, format: Explorer, legality: Legal, format: Gladiator, legality: Legal, format: Historic, legality: Legal, format: Historicbrawl, legality: Legal, format: Legacy, legality: Legal, format: Modern, legality: Legal, format: Oathbreaker, legality: Legal, format: Penny, legality: Legal, format: Pioneer, legality: Legal, format: Vintage, legality: Legal"
Essence Symbiote,{1}{G},2.0,G,Creature — Beast,,Beast,"Whenever a creature you control mutates, put a +1/+1 counter on that creature and you gain 2 life.",2,2,,"format: Commander, legality: Legal, format: Duel, legality: Legal, format: Explorer, legality: Legal, format: Gladiator, legality: Legal, format: Historic, legality: Legal, format: Historicbrawl, legality: Legal, format: Legacy, legality: Legal, format: Modern, legality: Legal, format: Oathbreaker, legality: Legal, format: Pauper, legality: Legal, format: Paupercommander, legality: Legal, format: Penny, legality: Legal, format: Pioneer, legality: Legal, format: Vintage, legality: Legal"
Excavation Mole,{2}{G},3.0,G,Creature — Mole,,Mole,"Trample
When Excavation Mole enters the battlefield, mill three cards.",3,3,,"format: Commander, legality: Legal, format: Duel, legality: Legal, format: Explorer, legality: Legal, format: Gladiator, legality: Legal, format: Historic, legality: Legal, format: Historicbrawl, legality: Legal, format: Legacy, legality: Legal, format: Modern, legality: Legal, format: Oathbreaker, legality: Legal, format: Pauper, legality: Legal, format: Paupercommander, legality: Legal, format: Penny, legality: Legal, format: Pioneer, legality: Legal, format: Vintage, legality: Legal"
Exuberant Wolfbear,{3}{G},4.0,G,Creature — Wolf Bear,,"Wolf, Bear","Whenever Exuberant Wolfbear attacks, you may change the base power and toughness of target Human you control to Exuberant Wolfbear's power and toughness until end of turn.",4,4,,"format: Commander, legality: Legal, format: Duel, legality: Legal, format: Explorer, legality: Legal, format: Gladiator, legality: Legal, format: Historic, legality: Legal, format: Historicbrawl, legality: Legal, format: Legacy, legality: Legal, format: Modern, legality: Legal, format: Oathbreaker, legality: Legal, format: Paupercommander, legality: Restricted, format: Penny, legality: Legal, format: Pioneer, legality: Legal, format: Vintage, legality: Legal"
Flycatcher Giraffid,{4}{G},5.0,G,Creature — Antelope Lizard,,"Antelope, Lizard",Flycatcher Giraffid enters the battlefield with your choice of a vigilance counter or a reach counter on it.,3,5,,"format: Commander, legality: Legal, format: Duel, legality: Legal, format: Explorer, legality: Legal, format: Gladiator, legality: Legal, format: Historic, legality: Legal, format: Historicbrawl, legality: Legal, format: Legacy, legality: Legal, format: Modern, legality: Legal, format: Oathbreaker, legality: Legal, format: Pauper, legality: Legal, format: Paupercommander, legality: Legal, format: Penny, legality: Legal, format: Pioneer, legality: Legal, format: Vintage, legality: Legal"
Fully Grown,{2}{G},3.0,G,Instant,,,Target creature gets +3/+3 until end of turn. Put a trample counter on it.,,,,"format: Commander, legality: Legal, format: Duel, legality: Legal, format: Explorer, legality: Legal, format: Gladiator, legality: Legal, format: Historic, legality: Legal, format: Historicbrawl, legality: Legal, format: Legacy, legality: Legal, format: Modern, legality: Legal, format: Oathbreaker, legality: Legal, format: Pauper, legality: Legal, format: Paupercommander, legality: Legal, format: Penny, legality: Legal, format: Pioneer, legality: Legal, format: Vintage, legality: Legal"
Gemrazer,{3}{G},4.0,G,Creature — Beast,,Beast,"Mutate {1}{G}{G} (If you cast this spell for its mutate cost, put it over or under target non-Human creature you own. They mutate into the creature on top plus all abilities from under it.)
Reach, trample
Whenever this creature mutates, destroy target artifact or enchantment an opponent controls.",4,4,,"format: Commander, legality: Legal, format: Duel, legality: Legal, format: Explorer, legality: Legal, format: Gladiator, legality: Legal, format: Historic, legality: Legal, format: Historicbrawl, legality: Legal, format: Legacy, legality: Legal, format: Modern, legality: Legal, format: Oathbreaker, legality: Legal, format: Penny, legality: Legal, format: Pioneer, legality: Legal, format: Vintage, legality: Legal"
Glowstone Recluse,{2}{G},3.0,G,Creature — Spider,,Spider,"Mutate {3}{G} (If you cast this spell for its mutate cost, put it over or under target non-Human creature you own. They mutate into the creature on top plus all abilities from under it.)
Reach
Whenever this creature mutates, put two +1/+1 counters on it.",2,3,,"format: Commander, legality: Legal, format: Duel, legality: Legal, format: Explorer, legality: Legal, format: Gladiator, legality: Legal, format: Historic, legality: Legal, format: Historicbrawl, legality: Legal, format: Legacy, legality: Legal, format: Modern, legality: Legal, format: Oathbreaker, legality: Legal, format: Paupercommander, legality: Restricted, format: Penny, legality: Legal, format: Pioneer, legality: Legal, format: Vintage, legality: Legal"
Honey Mammoth,{4}{G}{G},6.0,G,Creature — Elephant,,Elephant,"When Honey Mammoth enters the battlefield, you gain 4 life.",6,6,,"format: Commander, legality: Legal, format: Duel, legality: Legal, format: Explorer, legality: Legal, format: Gladiator, legality: Legal, format: Historic, legality: Legal, format: Historicbrawl, legality: Legal, format: Legacy, legality: Legal, format: Modern, legality: Legal, format: Oathbreaker, legality: Legal, format: Pauper, legality: Legal, format: Paupercommander, legality: Legal, format: Penny, legality: Legal, format: Pioneer, legality: Legal, format: Vintage, legality: Legal"
Hornbash Mentor,{2}{G},3.0,G,Creature — Human Warrior,,"Human, Warrior","When Hornbash Mentor enters the battlefield, put a trample counter on target non-Human creature you control.
{2}{G}, {T}: Put a +1/+1 counter on each creature you control with trample.",3,3,,"format: Commander, legality: Legal, format: Duel, legality: Legal, format: Explorer, legality: Legal, format: Gladiator, legality: Legal, format: Historic, legality: Legal, format: Historicbrawl, legality: Legal, format: Legacy, legality: Legal, format: Modern, legality: Legal, format: Oathbreaker, legality: Legal, format: Paupercommander, legality: Restricted, format: Penny, legality: Legal, format: Pioneer, legality: Legal, format: Vintage, legality: Legal"
Humble Naturalist,{1}{G},2.0,G,Creature — Human Druid,,"Human, Druid",{T}: Add one mana of any color. Spend this mana only to cast a creature spell.,1,3,,"format: Commander, legality: Legal, format: Duel, legality: Legal, format: Explorer, legality: Legal, format: Gladiator, legality: Legal, format: Historic, legality: Legal, format: Historicbrawl, legality: Legal, format: Legacy, legality: Legal, format: Modern, legality: Legal, format: Oathbreaker, legality: Legal, format: Pauper, legality: Legal, format: Paupercommander, legality: Legal, format: Penny, legality: Legal, format: Pioneer, legality: Legal, format: Vintage, legality: Legal"
Ivy Elemental,{X}{G},1.0,G,Creature — Elemental,,Elemental,Ivy Elemental enters the battlefield with X +1/+1 counters on it.,0,0,,"format: Commander, legality: Legal, format: Duel, legality: Legal, format: Explorer, legality: Legal, format: Gladiator, legality: Legal, format: Historic, legality: Legal, format: Historicbrawl, legality: Legal, format: Legacy, legality: Legal, format: Modern, legality: Legal, format: Oathbreaker, legality: Legal, format: Pauper, legality: Legal, format: Paupercommander, legality: Legal, format: Penny, legality: Legal, format: Pioneer, legality: Legal, format: Predh, legality: Legal, format: Premodern, legality: Legal, format: Vintage, legality: Legal"
"Kogla, the Titan Ape",{3}{G}{G}{G},6.0,G,Legendary Creature — Ape,Legendary,Ape,"When Kogla, the Titan Ape enters the battlefield, it fights up to one target creature you don't control.
Whenever Kogla attacks, destroy target artifact or enchantment defending player controls.
{1}{G}: Return target Human you control to its owner's hand. Kogla gains indestructible until end of turn.",7,6,,"format: Commander, legality: Legal, format: Duel, legality: Legal, format: Explorer, legality: Legal, format: Gladiator, legality: Legal, format: Historic, legality: Legal, format: Historicbrawl, legality: Legal, format: Legacy, legality: Legal, format: Modern, legality: Legal, format: Oathbreaker, legality: Legal, format: Penny, legality: Legal, format: Pioneer, legality: Legal, format: Vintage, legality: Legal"
Migratory Greathorn,{3}{G},4.0,G,Creature — Beast,,Beast,"Mutate {2}{G} (If you cast this spell for its mutate cost, put it over or under target non-Human creature you own. They mutate into the creature on top plus all abilities from under it.)
Whenever this creature mutates, search your library for a basic land card, put it onto the battlefield tapped, then shuffle.",3,4,,"format: Commander, legality: Legal, format: Duel, legality: Legal, format: Explorer, legality: Legal, format: Gladiator, legality: Legal, format: Historic, legality: Legal, format: Historicbrawl, legality: Legal, format: Legacy, legality: Legal, format: Modern, legality: Legal, format: Oathbreaker, legality: Legal, format: Pauper, legality: Legal, format: Paupercommander, legality: Legal, format: Penny, legality: Legal, format: Pioneer, legality: Legal, format: Vintage, legality: Legal"
Monstrous Step,{4}{G},5.0,G,Sorcery,,,"Target creature gets +7/+7 until end of turn. Up to one other target creature blocks it this turn if able.
Cycling {2} ({2}, Discard this card: Draw a card.)",,,,"format: Commander, legality: Legal, format: Duel, legality: Legal, format: Explorer, legality: Legal, format: Gladiator, legality: Legal, format: Historic, legality: Legal, format: Historicbrawl, legality: Legal, format: Legacy, legality: Legal, format: Modern, legality: Legal, format: Oathbreaker, legality: Legal, format: Penny, legality: Legal, format: Pioneer, legality: Legal, format: Vintage, legality: Legal"
Mosscoat Goriak,{2}{G},3.0,G,Creature — Beast,,Beast,Vigilance,2,4,,"format: Commander, legality: Legal, format: Duel, legality: Legal, format: Explorer, legality: Legal, format: Gladiator, legality: Legal, format: Historic, legality: Legal, format: Historicbrawl, legality: Legal, format: Legacy, legality: Legal, format: Modern, legality: Legal, format: Oathbreaker, legality: Legal, format: Pauper, legality: Legal, format: Paupercommander, legality: Legal, format: Penny, legality: Legal, format: Pioneer, legality: Legal, format: Vintage, legality: Legal"
Mythos of Brokkos,{2}{G}{G},4.0,G,Sorcery,,,"If {U}{B} was spent to cast this spell, search your library for a card, put that card into your graveyard, then shuffle.
Return up to two permanent cards from your graveyard to your hand.",,,,"format: Commander, legality: Legal, format: Duel, legality: Legal, format: Explorer, legality: Legal, format: Gladiator, legality: Legal, format: Historic, legality: Legal, format: Historicbrawl, legality: Legal, format: Legacy, legality: Legal, format: Modern, legality: Legal, format: Oathbreaker, legality: Legal, format: Penny, legality: Legal, format: Pioneer, legality: Legal, format: Vintage, legality: Legal"
Sudden Spinnerets,{G},1.0,G,Instant,,,Target creature gets +1/+3 until end of turn. Put a reach counter on it. Untap it.,,,,"format: Commander, legality: Legal, format: Duel, legality: Legal, format: Explorer, legality: Legal, format: Gladiator, legality: Legal, format: Historic, legality: Legal, format: Historicbrawl, legality: Legal, format: Legacy, legality: Legal, format: Modern, legality: Legal, format: Oathbreaker, legality: Legal, format: Pauper, legality: Legal, format: Paupercommander, legality: Legal, format: Penny, legality: Legal, format: Pioneer, legality: Legal, format: Vintage, legality: Legal"
Survivors' Bond,{1}{G},2.0,G,Sorcery,,,"Choose one or both —
• Return target Human creature card from your graveyard to your hand.
• Return target non-Human creature card from your graveyard to your hand.",,,,"format: Commander, legality: Legal, format: Duel, legality: Legal, format: Explorer, legality: Legal, format: Gladiator, legality: Legal, format: Historic, legality: Legal, format: Historicbrawl, legality: Legal, format: Legacy, legality: Legal, format: Modern, legality: Legal, format: Oathbreaker, legality: Legal, format: Pauper, legality: Legal, format: Paupercommander, legality: Legal, format: Penny, legality: Legal, format: Pioneer, legality: Legal, format: Vintage, legality: Legal"
Thwart the Enemy,{2}{G},3.0,G,Instant,,,Prevent all damage that would be dealt this turn by creatures your opponents control.,,,,"format: Commander, legality: Legal, format: Duel, legality: Legal, format: Explorer, legality: Legal, format: Gladiator, legality: Legal, format: Historic, legality: Legal, format: Historicbrawl, legality: Legal, format: Legacy, legality: Legal, format: Modern, legality: Legal, format: Oathbreaker, legality: Legal, format: Pauper, legality: Legal, format: Paupercommander, legality: Legal, format: Penny, legality: Legal, format: Pioneer, legality: Legal, format: Vintage, legality: Legal"
Titanoth Rex,{7}{G}{G},9.0,G,Creature — Dinosaur Beast,,"Dinosaur, Beast","Trample
Cycling {1}{G} ({1}{G}, Discard this card: Draw a card.)
When you cycle Titanoth Rex, put a trample counter on target creature you control.",11,11,,"format: Commander, legality: Legal, format: Duel, legality: Legal, format: Explorer, legality: Legal, format: Gladiator, legality: Legal, format: Historic, legality: Legal, format: Historicbrawl, legality: Legal, format: Legacy, legality: Legal, format: Modern, legality: Legal, format: Oathbreaker, legality: Legal, format: Paupercommander, legality: Restricted, format: Penny, legality: Legal, format: Pioneer, legality: Legal, format: Vintage, legality: Legal"
"Vivien, Monsters' Advocate",{3}{G}{G},5.0,G,Legendary Planeswalker — Vivien,Legendary,Vivien,"You may look at the top card of your library any time.
You may cast creature spells from the top of your library.
[+1]: Create a 3/3 green Beast creature token. Put your choice of a vigilance counter, a reach counter, or a trample counter on it.
[−2]: When you cast your next creature spell this turn, search your library for a creature card with lesser mana value, put it onto the battlefield, then shuffle.",,,3,"format: Commander, legality: Legal, format: Duel, legality: Legal, format: Explorer, legality: Legal, format: Gladiator, legality: Legal, format: Historic, legality: Legal, format: Historicbrawl, legality: Legal, format: Legacy, legality: Legal, format: Modern, legality: Legal, format: Oathbreaker, legality: Legal, format: Pioneer, legality: Legal, format: Vintage, legality: Legal"
Wilt,{1}{G},2.0,G,Instant,,,"Destroy target artifact or enchantment.
Cycling {2} ({2}, Discard this card: Draw a card.)",,,,"format: Commander, legality: Legal, format: Duel, legality: Legal, format: Explorer, legality: Legal, format: Gladiator, legality: Legal, format: Historic, legality: Legal, format: Historicbrawl, legality: Legal, format: Legacy, legality: Legal, format: Modern, legality: Legal, format: Oathbreaker, legality: Legal, format: Pauper, legality: Legal, format: Paupercommander, legality: Legal, format: Penny, legality: Legal, format: Pioneer, legality: Legal, format: Vintage, legality: Legal"
Back for More,{4}{B}{G},6.0,"B, G",Instant,,,"Return target creature card from your graveyard to the battlefield. When you do, it fights up to one target creature you don't control. (Each deals damage equal to its power to the other.)",,,,"format: Commander, legality: Legal, format: Duel, legality: Legal, format: Explorer, legality: Legal, format: Gladiator, legality: Legal, format: Historic, legality: Legal, format: Historicbrawl, legality: Legal, format: Legacy, legality: Legal, format: Modern, legality: Legal, format: Oathbreaker, legality: Legal, format: Penny, legality: Legal, format: Pioneer, legality: Legal, format: Vintage, legality: Legal"
Boneyard Lurker,{2}{B}{G},4.0,"B, G",Creature — Nightmare Beast,,"Nightmare, Beast","Mutate {2}{B/G}{B/G} (If you cast this spell for its mutate cost, put it over or under target non-Human creature you own. They mutate into the creature on top plus all abilities from under it.)
Whenever this creature mutates, return target permanent card from your graveyard to your hand.",4,4,,"format: Commander, legality: Legal, format: Duel, legality: Legal, format: Explorer, legality: Legal, format: Gladiator, legality: Legal, format: Historic, legality: Legal, format: Historicbrawl, legality: Legal, format: Legacy, legality: Legal, format: Modern, legality: Legal, format: Oathbreaker, legality: Legal, format: Paupercommander, legality: Restricted, format: Penny, legality: Legal, format: Pioneer, legality: Legal, format: Vintage, legality: Legal"
"Brokkos, Apex of Forever",{2}{B}{G}{U},5.0,"B, G, U",Legendary Creature — Nightmare Beast Elemental,Legendary,"Nightmare, Beast, Elemental","Mutate {2}{U/B}{G}{G} (If you cast this spell for its mutate cost, put it over or under target non-Human creature you own. They mutate into the creature on top plus all abilities from under it.)
Trample
You may cast Brokkos, Apex of Forever from your graveyard using its mutate ability.",6,6,,"format: Commander, legality: Legal, format: Duel, legality: Legal, format: Explorer, legality: Legal, format: Gladiator, legality: Legal, format: Historic, legality: Legal, format: Historicbrawl, legality: Legal, format: Legacy, legality: Legal, format: Modern, legality: Legal, format: Oathbreaker, legality: Legal, format: Penny, legality: Legal, format: Pioneer, legality: Legal, format: Vintage, legality: Legal"
Channeled Force,{2}{U}{R},4.0,"R, U",Instant,,,"As an additional cost to cast this spell, discard X cards.
Target player draws X cards. Channeled Force deals X damage to up to one target creature or planeswalker.",,,,"format: Commander, legality: Legal, format: Duel, legality: Legal, format: Explorer, legality: Legal, format: Gladiator, legality: Legal, format: Historic, legality: Legal, format: Historicbrawl, legality: Legal, format: Legacy, legality: Legal, format: Modern, legality: Legal, format: Oathbreaker, legality: Legal, format: Penny, legality: Legal, format: Pioneer, legality: Legal, format: Vintage, legality: Legal"
"Chevill, Bane of Monsters",{B}{G},2.0,"B, G",Legendary Creature — Human Rogue,Legendary,"Human, Rogue","Deathtouch
At the beginning of your upkeep, if your opponents control no permanents with bounty counters on them, put a bounty counter on target creature or planeswalker an opponent controls.
Whenever a permanent an opponent controls with a bounty counter on it dies, you gain 3 life and draw a card.",1,3,,"format: Commander, legality: Legal, format: Duel, legality: Legal, format: Explorer, legality: Legal, format: Gladiator, legality: Legal, format: Historic, legality: Legal, format: Historicbrawl, legality: Legal, format: Legacy, legality: Legal, format: Modern, legality: Legal, format: Oathbreaker, legality: Legal, format: Pioneer, legality: Legal, format: Vintage, legality: Legal"
Death's Oasis,{W}{B}{G},3.0,"B, G, W",Enchantment,,,"Whenever a nontoken creature you control dies, mill two cards. Then return a creature card with lesser mana value than the creature that died from your graveyard to your hand.
{1}, Sacrifice Death's Oasis: You gain life equal to the highest mana value among creatures you control.",,,,"format: Commander, legality: Legal, format: Duel, legality: Legal, format: Explorer, legality: Legal, format: Gladiator, legality: Legal, format: Historic, legality: Legal, format: Historicbrawl, legality: Legal, format: Legacy, legality: Legal, format: Modern, legality: Legal, format: Oathbreaker, legality: Legal, format: Penny, legality: Legal, format: Pioneer, legality: Legal, format: Vintage, legality: Legal"
Dire Tactics,{W}{B},2.0,"B, W",Instant,,,"Exile target creature. If you don't control a Human, you lose life equal to that creature's toughness.",,,,"format: Commander, legality: Legal, format: Duel, legality: Legal, format: Explorer, legality: Legal, format: Gladiator, legality: Legal, format: Historic, legality: Legal, format: Historicbrawl, legality: Legal, format: Legacy, legality: Legal, format: Modern, legality: Legal, format: Oathbreaker, legality: Legal, format: Penny, legality: Legal, format: Pioneer, legality: Legal, format: Vintage, legality: Legal"
Eerie Ultimatum,{W}{W}{B}{B}{B}{G}{G},7.0,"B, G, W",Sorcery,,,Return any number of permanent cards with different names from your graveyard to the battlefield.,,,,"format: Commander, legality: Legal, format: Duel, legality: Legal, format: Explorer, legality: Legal, format: Gladiator, legality: Legal, format: Historic, legality: Legal, format: Historicbrawl, legality: Legal, format: Legacy, legality: Legal, format: Modern, legality: Legal, format: Oathbreaker, legality: Legal, format: Penny, legality: Legal, format: Pioneer, legality: Legal, format: Vintage, legality: Legal"
Emergent Ultimatum,{B}{B}{G}{G}{G}{U}{U},7.0,"B, G, U",Sorcery,,,Search your library for up to three monocolored cards with different names and exile them. An opponent chooses one of those cards. Shuffle that card into your library. You may cast the other cards without paying their mana costs. Exile Emergent Ultimatum.,,,,"format: Commander, legality: Legal, format: Duel, legality: Legal, format: Explorer, legality: Legal, format: Gladiator, legality: Legal, format: Historic, legality: Legal, format: Historicbrawl, legality: Legal, format: Legacy, legality: Legal, format: Modern, legality: Legal, format: Oathbreaker, legality: Legal, format: Pioneer, legality: Legal, format: Vintage, legality: Legal"
Frondland Felidar,{2}{G}{W},4.0,"G, W",Creature — Cat Beast,,"Cat, Beast","Vigilance
Creatures you control with vigilance have ""{1}, {T}: Tap target creature.""",3,5,,"format: Commander, legality: Legal, format: Duel, legality: Legal, format: Explorer, legality: Legal, format: Gladiator, legality: Legal, format: Historic, legality: Legal, format: Historicbrawl, legality: Legal, format: Legacy, legality: Legal, format: Modern, legality: Legal, format: Oathbreaker, legality: Legal, format: Penny, legality: Legal, format: Pioneer, legality: Legal, format: Vintage, legality: Legal"
